{
  "schema_version": "1.1.0",
  "title": "Fix five critical lifecycle and publication issues",
  "intent": "Resolve1218,1075,1076,1366,1045 in one draft PR without infrastructure changes or merge",
  "state": "APPROVED",
  "todo_ids": [
    "bugs_01m4jdaambn944vm"
  ],
  "proof_hooks": [
    "cargo test --lib",
    "cargo clippy --all-targets --all-features -- -D warnings",
    "decapod validate"
  ],
  "unknowns": [],
  "human_questions": [],
  "stop_conditions": [],
  "unresolved_contradictions": [],
  "deferred_questions": [
    "Actual Docker custody unavailable in this environment"
  ],
  "constraints": {
    "forbidden_paths": [],
    "file_touch_budget": null
  },
  "phases": [],
  "updated_at": "1791650584Z",
  "spec_reviews": [
    {
      "path": ".decapod/managed/specs/ARCHITECTURE.md",
      "spec_material_hash": "b0835ece6bd42daee979585d7336ffdf579cfa3d5b036acec0ade4f860d9a9e0",
      "reviewed_code_fingerprint": "c60a91077200b9e05578ac6e32646771cbc3e73cde13cca031d4073bfba268b0",
      "disposition": "updated",
      "reason": "Reviewed scoped Actions fixes against current ARCHITECTURE contracts: recorded runtime provenance, dedicated lifecycle event stream, explicit advisory unlock, acknowledged claim follow-up outside broker locks, and private federation rebuild directory; authored contracts and focused regressions reflect these boundaries."
    },
    {
      "path": ".decapod/managed/specs/INTERFACES.md",
      "spec_material_hash": "ec59736eba382f3e01ea03fd8fb7eebe415cc343a48075e6e9a91efcd238621a",
      "reviewed_code_fingerprint": "c60a91077200b9e05578ac6e32646771cbc3e73cde13cca031d4073bfba268b0",
      "disposition": "updated",
      "reason": "Reviewed scoped Actions fixes against current INTERFACES contracts: recorded runtime provenance, dedicated lifecycle event stream, explicit advisory unlock, acknowledged claim follow-up outside broker locks, and private federation rebuild directory; authored contracts and focused regressions reflect these boundaries."
    },
    {
      "path": ".decapod/managed/specs/SECURITY.md",
      "spec_material_hash": "ad35c389324be26f9a505ea2561acf50ac674e263d0835724a2e9fd9783ac56f",
      "reviewed_code_fingerprint": "c60a91077200b9e05578ac6e32646771cbc3e73cde13cca031d4073bfba268b0",
      "disposition": "updated",
      "reason": "Reviewed scoped Actions fixes against current SECURITY contracts: recorded runtime provenance, dedicated lifecycle event stream, explicit advisory unlock, acknowledged claim follow-up outside broker locks, and private federation rebuild directory; authored contracts and focused regressions reflect these boundaries."
    }
  ]
}